<?xml version="1.0" encoding="UTF-8"?>
<!--Sample XML file generated by XMLSpy v2006 U (http://www.altova.com)-->
<root xmlns="http://www.portalfiscal.inf.br/passefiscal/ws/AutorizacaoPasseFiscal.xsd" xmlns:xsi="http://www.w3.org/2001/XMLSchema-instance" xsi:schemaLocation="http://www.portalfiscal.inf.br/passefiscal/ws/AutorizacaoPasseFiscal.xsd
C:\WebPhp5\web\Nfs\AutorizacaoPasseFiscal.xsd">
	<PF>
		<NFs>
			<idNF>
				<nroNota>0</nroNota>
				<cpfCnpj>00000000000</cpfCnpj>
			</idNF>
		</NFs>
		<numero>00000000000000000000</numero>
		<linhaDig>000000000000000</linhaDig>
		<data>0/0/0000</data>
		<hora>0:00:00</hora>
	</PF>
</root>
